{
  "schema": "acumos.schema.model:0.4.0",
  "runtime": {
    "name": "python",
    "encoding": "protobuf",
    "version": "3.6.8",
    "dependencies": {
      "pip": {
        "indexes": [],
        "requirements": [
          {
            "name": "acumos",
            "version": "0.7.2"
          },
          {
            "name": "dill",
            "version": "0.2.7.1"
          }
        ]
      },
      "conda": {
        "channels": [],
        "requirements": []
      }
    }
  },
  "name": "example-model",
  "methods": {
    "add": {
      "input": "AddIn",
      "output": "AddOut",
      "description": "Adds two numbers"
    },
    "count": {
      "input": "CountIn",
      "output": "CountOut",
      "description": "Counts the occurrences of words in `strings`"
    }
  }
}